{
  "$schema": "https://json-schema.org/draft/2020-12/schema",
  "$id": "https://b7n0de.com/proofbundle/conformance/vector_schema.v1.json",
  "title": "proofbundle conformance vector (case.json)",
  "description": "Fundament F1 — the ONE machine-readable vector format for the whole conformance corpus. The offline runner (run_conformance.py), the cross-format comparator (cross_format.py) and the Python<->Rust differential (crosscheck.py) all consume THIS format; there is no second vector format in the repo. A case declares what it proves (expected) AND, optionally, its cross-format identity (crossFormatId) so the SAME logical scenario expressed in different encodings can be held to ONE common-vocabulary verdict (conformance/common_vocabulary.py). Additive: 3.4.0/3.5.0/3.6.0 add new expected axes and kinds here, never a parallel schema.",
  "type": "object",
  "required": [
    "caseId",
    "kind",
    "expected"
  ],
  "additionalProperties": true,
  "properties": {
    "caseId": {
      "type": "string",
      "minLength": 1,
      "description": "Stable, human-readable id, unique across the corpus."
    },
    "kind": {
      "type": "string",
      "enum": [
        "decision_crossimpl",
        "native_bundle",
        "decision_relation",
        "outcome_relation",
        "relation_statement",
        "provenance_version_status",
        "envelope_profile_rule",
        "agent_review_predicate",
        "cap1_document",
        "content_root_vector"
      ],
      "description": "Dispatch key for the runner. New kinds are added additively (fail-closed: an unknown kind is a per-case FAIL, never a silent skip). outcome_relation (3.4.0, WP-B) mirrors decision_relation on the action-outcome verify path. relation_statement (3.5.0, WP-A) is the standalone relation-statement/v0.1 verify path (`relation-statement verify`). provenance_version_status (5.0.0) checks a provenance block against the reported-version status rule: every harness-reported version field carries an explicit three-value status, a mandatory reason when it is not `reported`, and the pair may not contradict itself. envelope_profile_rule (5.1) checks one rule of the receipt-envelope profile (docs/RECEIPT_ENVELOPE_PROFILE.md) through OUR OWN emit/verify path; each rule R1-R5 carries one counter-proof and one positive control, and the case declares WHICH expectation axis it asserts (contentRootHex / nonConformantDiffers / canonicalizeRefuses / classification) - a case declaring none is a fail-closed FAIL, never a silent pass. content_root_vector pins the ONE statement content-root primitive (ADR 0002): canonical bytes, roots on both sides of the two-part rule, cross-predicate root references, declared-algorithm binding (confusion rejected, named legacy accepted), and envelope-signature invariance."
    },
    "mode": {
      "type": "string",
      "enum": ["canonical", "pair_reference", "binding", "envelope_invariance"],
      "description": "content_root_vector only: which check family the case exercises. An unknown/missing mode is a per-case FAIL (fail-closed)."
    },
    "input": {
      "type": "string",
      "description": "Relative fixture filename inside the case directory (confined; no traversal, no absolute path)."
    },
    "pub": {
      "type": "string",
      "description": "decision_relation only: relative filename holding the base64 public key."
    },
    "related": {
      "type": "array",
      "items": {
        "type": "string"
      },
      "description": "decision_relation/outcome_relation only: attached predecessor receipts (--with-related)."
    },
    "relatedPubs": {
      "type": "array",
      "items": {
        "type": "string"
      },
      "description": "WP-A (3.4.0): base64 issuer keys position-paired with `related` (i-th key for the i-th target; empty string = same-key/--pub). Enables cross-issuer chains verified under relation_signer."
    },
    "policy": {
      "type": "string",
      "description": "Optional relative filename of a trust policy fixture."
    },
    "verifyArgs": {
      "type": "array",
      "items": {
        "type": "string"
      },
      "description": "Extra CLI verify args drawn from a small allowlist (no file/network flags)."
    },
    "requiresAnchorsExtra": {
      "type": "boolean",
      "description": "The deciding rejection reason needs the [anchors] extra; skipped honestly on a base install unless --require-anchors."
    },
    "expected": {
      "type": "object",
      "description": "Fail-closed declaration of the verdict. At least one axis MUST be pinned. The runner asserts every pinned axis; an unpinned axis is not compared. exitCode/exitClass, lineage and policyVerdict map onto the F1 common vocabulary.",
      "minProperties": 1,
      "additionalProperties": true,
      "properties": {
        "exitCode": {
          "type": "integer",
          "enum": [
            0,
            1,
            2,
            3
          ],
          "description": "CLI verify exit-code contract: 0 VERIFIED, 1 CRYPTO_FAIL, 2 MALFORMED, 3 POLICY_UNMET."
        },
        "exitClass": {
          "type": "string",
          "enum": [
            "VERIFIED",
            "CRYPTO_FAIL",
            "MALFORMED",
            "POLICY_UNMET"
          ],
          "description": "Named exit class (alternative to the numeric exitCode; the F1 vocabulary maps between them)."
        },
        "lineage": {
          "type": [
            "string",
            "null"
          ],
          "enum": [
            "VERIFIED",
            "DECLARED_UNRESOLVED",
            "FAIL",
            "NOT_EVALUATED",
            null
          ],
          "description": "relation/v0.1 lineage state. null == NOT_EVALUATED (same observable fact)."
        },
        "policyVerdict": {
          "type": "string",
          "enum": [
            "ALLOW",
            "DENY",
            "REFUSE",
            "ESCALATE",
            "DEFER",
            "OBSERVE"
          ],
          "description": "Decision predicate verdict, when the case exercises one."
        },
        "rejected": {
          "type": "boolean"
        },
        "errorContains": {
          "type": "string"
        },
        "cap1Rules": {
          "type": "array",
          "items": {
            "type": "string"
          },
          "description": "cap1_document only: the EXACT set of CAP-1 rules (R0-R8 ids) that must fire on the document; [] means conformant. Compared as a set, fail-closed — a counter-proof that fails for the wrong reason proves nothing about its rule."
        },
        "contentRoot": {"type": "string", "pattern": "^[0-9a-f]{64}$", "description": "content_root_vector: the pinned 64-hex statement content root."},
        "decisionRoot": {"type": "string", "pattern": "^[0-9a-f]{64}$"},
        "evidenceRoot": {"type": "string", "pattern": "^[0-9a-f]{64}$"},
        "objectAndBytesAgree": {"const": true, "description": "content_root_vector canonical mode: definitional — must be literally true (iteration 2, lens 3: bool('false') is True, so a string here was exploitable; the handler enforces the same floor dependency-free)."},
        "evidenceRefBindsRoot": {"const": true, "description": "content_root_vector pair_reference mode: definitional — must be literally true; the measured binding is additionally an unconditional handler floor (iteration 2, lens 2)."},
        "bindingOk": {"type": "boolean", "description": "content_root_vector binding mode: JSON boolean only — both verdicts are valid declarations (confusion rejected / legacy accepted)."},
        "jcsFile": {"type": "string"},
        "decisionJcsFile": {"type": "string"},
        "evidenceJcsFile": {"type": "string"},
        "secondEnvelope": {"type": "string"},
        "alg": {"type": "string"}
      }
    },
    "crossFormatId": {
      "type": "string",
      "pattern": "^[a-z0-9]+(-[a-z0-9]+)*$",
      "description": "Cross-format identity. Cases sharing a crossFormatId are the SAME logical scenario in different encodings/levels and MUST agree on the F1 common-vocabulary verdict (cross_format.py enforces this — structurally closing the 3.4.0 F3 'circular' finding)."
    },
    "specRefs": {
      "type": "array",
      "items": {
        "type": "string"
      },
      "description": "Pointers to the spec/design sections this case pins."
    },
    "rationale": {
      "type": "string"
    },
    "attribution": {
      "type": "string"
    },
    "testKeys": {
      "type": "string"
    }
  }
}
