{
  "caseId": "relation-unauthorized-signer",
  "kind": "decision_relation",
  "input": "receipt.json",
  "pub": "pub.b64",
  "expected": {
    "exitCode": 2,
    "lineage": "FAIL",
    "errorContains": "relation:target_verification_failed"
  },
  "attribution": "b7n0de / relation-v0.1 corpus generator (conformance/relation/generate_vectors.py, 2026-07-16)",
  "specRefs": [
    "docs/predicates/relation.md",
    "docs/design/RELATION_V01_DESIGN.md"
  ],
  "rationale": "The attached predecessor is signed by a FOREIGN key (same-key CLI contract): attached-but-unverified is present-and-wrong and FAILS hard — unlike an absent target, which stays declared-only.",
  "testKeys": "fresh throwaway keys, generated by conformance/relation/generate_vectors.py",
  "related": [
    "related_b.json"
  ]
}
