{
  "caseId": "outcome-relation-declared-supersedes-verified",
  "kind": "outcome_relation",
  "input": "receipt.json",
  "pub": "pub.b64",
  "expected": {
    "exitCode": 0,
    "lineage": "VERIFIED"
  },
  "attribution": "b7n0de / relation-v0.1 corpus generator (conformance/relation/generate_vectors.py, 2026-07-16)",
  "specRefs": [
    "docs/predicates/relation.md",
    "docs/design/RELATION_V01_DESIGN.md"
  ],
  "rationale": "WP-B (e/t2): declared supersession with the predecessor attached and standalone-verified on the OUTCOME path: lineage VERIFIED.",
  "testKeys": "fresh throwaway keys, generated by conformance/relation/generate_vectors.py",
  "related": [
    "related_b.json"
  ],
  "crossFormatId": "xfmt-t2"
}
