{
  "caseId": "relation-statement-retracts-unauthorized",
  "kind": "relation_statement",
  "input": "receipt.json",
  "pub": "pub.b64",
  "expected": {
    "exitCode": 3,
    "lineage": "VERIFIED",
    "errorContains": "RELATION_SIGNER_UNAUTHORIZED"
  },
  "attribution": "b7n0de / relation-v0.1 corpus generator (conformance/relation/generate_vectors.py, 2026-07-16)",
  "specRefs": [
    "docs/predicates/relation.md",
    "docs/design/RELATION_V01_DESIGN.md"
  ],
  "rationale": "WP-A: the statement is signed by a FOREIGN ring Y but relation_signer pins the retracts relation to X. Whether the issuer may declare the retraction is relying-party policy → RELATION_SIGNER_UNAUTHORIZED, exit 3. The statement is still crypto-valid and the target still resolves (lineage VERIFIED); the block is EXCLUSIVELY in the policy verdict (lattice monotonicity).",
  "testKeys": "fresh throwaway keys, generated by conformance/relation/generate_vectors.py",
  "related": [
    "related_t.json"
  ],
  "relatedPubs": [
    "Pv6iLpxNqJ6Fe7WRc23me9km0Lv+KeuE2mVM74wCxqM="
  ],
  "policy": "policy.json"
}
