{
  "caseId": "relation-edge-corrects",
  "kind": "decision_relation",
  "input": "receipt.json",
  "pub": "pub.b64",
  "expected": {
    "exitCode": 0,
    "lineage": "VERIFIED"
  },
  "attribution": "b7n0de / relation-v0.1 corpus generator (conformance/relation/generate_vectors.py, 2026-07-16)",
  "specRefs": [
    "docs/predicates/relation.md",
    "docs/design/RELATION_V01_DESIGN.md"
  ],
  "rationale": "One vector per relation: a corrects edge onto the attached, verified predecessor resolves to lineage VERIFIED with the relation's own semantics (mapping table in the SPEC chapter).",
  "testKeys": "fresh throwaway keys, generated by conformance/relation/generate_vectors.py",
  "related": [
    "related_b.json"
  ]
}
