{
  "caseId": "outcome-relation-decoy-parent-target-mismatch",
  "kind": "outcome_relation",
  "input": "receipt.json",
  "pub": "pub.b64",
  "expected": {
    "exitCode": 3,
    "lineage": "VERIFIED",
    "errorContains": "RELATION_TARGET_MISMATCH"
  },
  "attribution": "Loek Verdonk / No Silent Landing — adversarial review PROOFBUNDLE_3_3_0_ADVERSARIAL_REVIEW_V0.zip finding F1 (decoy parent), empirically reproduced 2026-07-16; b7n0de 3.4.0 fix",
  "specRefs": [
    "docs/predicates/relation.md",
    "docs/design/RELATION_V01_DESIGN.md"
  ],
  "rationale": "WP-B + WP-A2: the decoy-parent fix holds on the OUTCOME path too — child supersedes->RX (valid) is rejected under require_relation_target pinning R0, exit 3, RELATION_TARGET_MISMATCH.",
  "testKeys": "fresh throwaway keys, generated by conformance/relation/generate_vectors.py",
  "related": [
    "related_r0.json",
    "related_rx.json"
  ],
  "relatedPubs": [
    "EUNukId13G+XpEuVmsfEUi9tXFf80iGBmfAd933g5/Q=",
    "EUNukId13G+XpEuVmsfEUi9tXFf80iGBmfAd933g5/Q="
  ],
  "policy": "policy.json",
  "crossFormatId": "xfmt-t3-decoy"
}
