{
  "caseId": "relation-signer-cross-issuer-verified",
  "kind": "decision_relation",
  "input": "receipt.json",
  "pub": "pub.b64",
  "expected": {
    "exitCode": 0,
    "lineage": "VERIFIED"
  },
  "attribution": "b7n0de / relation-v0.1 corpus generator (conformance/relation/generate_vectors.py, 2026-07-16)",
  "specRefs": [
    "docs/predicates/relation.md",
    "docs/design/RELATION_V01_DESIGN.md"
  ],
  "rationale": "WP-A: a successor of ring X supersedes a predecessor of a FOREIGN ring Y; the predecessor is attached and verifies under its own key (--related-pub), and X is a member of the pinned relation_signer set. Cross-issuer lineage VERIFIED + policy PASS. Set membership under the verifier's pins, never a proof of authority.",
  "testKeys": "fresh throwaway keys, generated by conformance/relation/generate_vectors.py",
  "related": [
    "related_b.json"
  ],
  "relatedPubs": [
    "rlF+h6SkkJAyNksHq3QVMabfk9hECIFZtzWPMp5THZ0="
  ],
  "policy": "policy.json"
}
