{
  "caseId": "decision-crossimpl-schema-conformant",
  "kind": "decision_crossimpl",
  "input": "schema-conformant",
  "attribution": "MarkovianProtocol / Colin — audit-anchor@ff6a000 (examples/decision-receipt). MIT License, Copyright (c) 2026 SigmaSynth LLC. Vendored as pure data; no local edits to the vendored bytes.",
  "expected": {
    "jcs_byte_identical": true,
    "content_roots_match_manifest": true,
    "evidence_ref_binds_content_root": true,
    "decision_content_root": "97e1d74b810a9fea454ac890c0e17f8a401fb4abbf42827a39aea30846de2fb5",
    "evidence_content_root": "323adb188f840e90331c920b32a73f348acc5caea8d40f9a84ea384d46c258d4",
    "decision_predicate_findings": 0,
    "schema_conformant": true,
    "anchor": {
      "height": 958761,
      "status": "confirmed",
      "frozen": {
        "bitcoinBlockHeaderMerkleRootsByHeight": {
          "958761": "a8e521caf1a50d99240c1808c276cd75e3a3f24f292836593908a16a3ea24f8c"
        }
      },
      "independent_source": {
        "provider": "blockstream.info + blockchain.info",
        "block_hash": "00000000000000000001b882ed05ae87bce809336f7cc3d52947c1c128b34dd2",
        "merkle_root_display_be": "8c4fa23e6aa10839593628294ff2a3e375cd76c208180c24990da5f1ca21e5a8",
        "note": "Block 958761 header independently fetched from two providers (blockstream.info and blockchain.info), same block hash and merkle root. The frozen value is the block-internal (little-endian) merkle root that OpenTimestamps commits to; it is the byte-reverse of the big-endian value block explorers display. Fetched once, offline-verifiable forever against any Bitcoin block header for height 958761."
      },
      "rpTrust": {
        "bitcoinBlockHeaderMerkleRootsByHeight": {
          "958761": "a8e521caf1a50d99240c1808c276cd75e3a3f24f292836593908a16a3ea24f8c"
        }
      },
      "_wp_a1_note": "WP-A1: bitcoinBlockHeaderMerkleRootsByHeight under rpTrust is RELYING-PARTY trust (independently sourced from independent_source above); frozen is kept as producer evidence only and is NEVER trusted. A confirmed verdict requires the relying-party header. The same OTS proof WITHOUT the relying-party header reports needs_rp_trust, not confirmed."
    }
  },
  "specRefs": [
    "docs/predicates/decision-receipt.md#7.1",
    "docs/ANCHORS.md",
    "SPEC.md"
  ],
  "rationale": "The first full end-to-end decision-receipt/v0.1 conformance case in the corpus: a second, independent implementation (MarkovianProtocol / audit-anchor) produces a decision-receipt statement pair whose .jcs bytes are byte-identical with proofbundle's RFC 8785 canonical output, whose content roots recompute to the MANIFEST values (evidence 323adb18…, decision 97e1d74b…), whose evidenceRef binds the evidence content root, whose predicate validates clean against decision-receipt/v0.1 in NORMAL and STRICT mode (0 findings — schema-conformant), and whose OpenTimestamps proof carries a confirmed BitcoinBlockHeaderAttestation at height 958761 (the OTS-committed merkle root matches the real block merkle root independently fetched from blockstream.info and blockchain.info, verified offline against the relying-party header, never by contacting a calendar). This GRADUATES the canonicalization-only cross-impl iteration: it supersedes decision-crossimpl-canonicalization-root-binding (regenerated 3abe69f, decision root ff05e3e0…, schema expected-fail with 12 findings, anchor pending), which is retained as a historical iteration per CONFORMANCE.md rule 5 (no silent changes; a regeneration is a new case, the old one kept). Colin re-anchored once more (a35dee8 -> ff6a000) against the enforced schema and confirmed the Bitcoin anchor. Vendored digest-pinned as pure data, credited (MIT / SigmaSynth LLC)."
}
